{
  "$schema": "https://pandorakit.com/schemas/manifest-v1.json",
  "manifestVersion": 1,
  "id": "@pandorakit/datetime",
  "name": "Date & Time",
  "description": "Let your assistant know the current date and time",
  "author": "Pandora",
  "version": "0.1.0",
  "license": "MIT",
  "repository": "https://github.com/mprasanjith/pandora/tree/master/packages/datetime",
  "pandora": ">=0.0.1",
  "provides": {
    "tools": {
      "entry": "./src/index.ts",
      "sandbox": "compartment",
      "permissions": {
        "time": true
      }
    }
  }
}
